{
  "format": "graph-studio-workspace",
  "version": 1,
  "name": "Mathematics",
  "graphs": [
    "mathematics.json",
    "complex-analysis.json",
    "real-analysis.json",
    "functional-analysis.json",
    "group-theory.json",
    "number-theory.json",
    "probability-theory.json",
    "set-theory-logic.json",
    "topology.json",
    "differential-geometry.json",
    "algebraic-geometry.json",
    "all-mathematics.json"
  ],
  "defaultGraph": "mathematics.json",
  "metadata": {
    "language": "en",
    "conceptCount": 202,
    "subjectCount": 10,
    "scope": "Selected advanced-undergraduate and beginning-graduate core with advanced gateways. Entries give precise scoped statements and proof ideas, not full proofs or exhaustive courses.",
    "assets": [
      "BIBLIOGRAPHY.md",
      "README.md",
      "STUDY-PATHWAYS.md",
      "guides/algebraic-geometry.md",
      "guides/complex-analysis.md",
      "guides/differential-geometry.md",
      "guides/functional-analysis.md",
      "guides/group-theory.md",
      "guides/number-theory.md",
      "guides/probability-theory.md",
      "guides/real-analysis.md",
      "guides/set-theory-logic.md",
      "guides/topology.md",
      "notes/ag.affine.md",
      "notes/ag.cohomology.md",
      "notes/ag.curves.md",
      "notes/ag.dimension.md",
      "notes/ag.divisors.md",
      "notes/ag.etale.md",
      "notes/ag.flat.md",
      "notes/ag.line-bundles.md",
      "notes/ag.localization.md",
      "notes/ag.morphisms.md",
      "notes/ag.noetherian.md",
      "notes/ag.nullstellensatz.md",
      "notes/ag.projective.md",
      "notes/ag.proper.md",
      "notes/ag.regular.md",
      "notes/ag.riemann-roch.md",
      "notes/ag.rings.md",
      "notes/ag.schemes.md",
      "notes/ag.serre-duality.md",
      "notes/ag.sheaves.md",
      "notes/ag.spec.md",
      "notes/ca.argument.md",
      "notes/ca.cauchy-formula.md",
      "notes/ca.cauchy.md",
      "notes/ca.continuation.md",
      "notes/ca.contours.md",
      "notes/ca.cr.md",
      "notes/ca.harmonic.md",
      "notes/ca.holomorphic.md",
      "notes/ca.identity.md",
      "notes/ca.liouville.md",
      "notes/ca.maximum.md",
      "notes/ca.mittag-leffler.md",
      "notes/ca.normal.md",
      "notes/ca.residues.md",
      "notes/ca.riemann-mapping.md",
      "notes/ca.riemann-surfaces.md",
      "notes/ca.rouche.md",
      "notes/ca.schwarz.md",
      "notes/ca.series.md",
      "notes/ca.singularities.md",
      "notes/dg.bundles.md",
      "notes/dg.cotangent.md",
      "notes/dg.curvature.md",
      "notes/dg.derham.md",
      "notes/dg.flows.md",
      "notes/dg.forms.md",
      "notes/dg.gauss-bonnet.md",
      "notes/dg.geodesics.md",
      "notes/dg.hodge.md",
      "notes/dg.hopf-rinow.md",
      "notes/dg.jacobi.md",
      "notes/dg.levi-civita.md",
      "notes/dg.lie.md",
      "notes/dg.metric.md",
      "notes/dg.orientation.md",
      "notes/dg.rank.md",
      "notes/dg.sard.md",
      "notes/dg.smooth.md",
      "notes/dg.stokes.md",
      "notes/dg.tangent.md",
      "notes/fa.alaoglu.md",
      "notes/fa.baire.md",
      "notes/fa.banach.md",
      "notes/fa.closed-graph.md",
      "notes/fa.compact-spectral.md",
      "notes/fa.compact.md",
      "notes/fa.dual.md",
      "notes/fa.fredholm.md",
      "notes/fa.hahn-banach.md",
      "notes/fa.hilbert.md",
      "notes/fa.lax-milgram.md",
      "notes/fa.open-mapping.md",
      "notes/fa.operators.md",
      "notes/fa.reflexive.md",
      "notes/fa.riesz.md",
      "notes/fa.spectral-measure.md",
      "notes/fa.spectrum.md",
      "notes/fa.unbounded.md",
      "notes/fa.uniform-boundedness.md",
      "notes/fa.weak.md",
      "notes/gt.abelian-structure.md",
      "notes/gt.actions.md",
      "notes/gt.characters.md",
      "notes/gt.class-equation.md",
      "notes/gt.galois.md",
      "notes/gt.groups.md",
      "notes/gt.isomorphism.md",
      "notes/gt.jordan-holder.md",
      "notes/gt.lagrange.md",
      "notes/gt.maschke.md",
      "notes/gt.nilpotent.md",
      "notes/gt.orbit-stabilizer.md",
      "notes/gt.presentations.md",
      "notes/gt.products.md",
      "notes/gt.quotients.md",
      "notes/gt.representations.md",
      "notes/gt.semidirect.md",
      "notes/gt.solvable.md",
      "notes/gt.subgroups.md",
      "notes/gt.sylow.md",
      "notes/nt.class-group.md",
      "notes/nt.crt.md",
      "notes/nt.dirichlet-characters.md",
      "notes/nt.dirichlet.md",
      "notes/nt.discriminant.md",
      "notes/nt.divisibility.md",
      "notes/nt.elliptic.md",
      "notes/nt.finite-fields.md",
      "notes/nt.ideals.md",
      "notes/nt.integers.md",
      "notes/nt.local-global.md",
      "notes/nt.minkowski.md",
      "notes/nt.mordell-weil.md",
      "notes/nt.number-fields.md",
      "notes/nt.padic.md",
      "notes/nt.pnt.md",
      "notes/nt.ramification.md",
      "notes/nt.reciprocity.md",
      "notes/nt.units.md",
      "notes/nt.zeta.md",
      "notes/pr.borel-cantelli.md",
      "notes/pr.brownian.md",
      "notes/pr.characteristic.md",
      "notes/pr.clt.md",
      "notes/pr.conditional.md",
      "notes/pr.convergence.md",
      "notes/pr.doob.md",
      "notes/pr.extension.md",
      "notes/pr.independence.md",
      "notes/pr.ito-formula.md",
      "notes/pr.ito-integral.md",
      "notes/pr.markov.md",
      "notes/pr.martingale-limit.md",
      "notes/pr.martingale.md",
      "notes/pr.regular.md",
      "notes/pr.slln.md",
      "notes/pr.space.md",
      "notes/pr.stopping.md",
      "notes/pr.ui.md",
      "notes/pr.weak.md",
      "notes/ra.absolute-continuity.md",
      "notes/ra.ascoli.md",
      "notes/ra.completeness.md",
      "notes/ra.dct.md",
      "notes/ra.differentiation.md",
      "notes/ra.distributions.md",
      "notes/ra.egorov.md",
      "notes/ra.fatou.md",
      "notes/ra.fourier.md",
      "notes/ra.fubini.md",
      "notes/ra.holder.md",
      "notes/ra.integral.md",
      "notes/ra.lp.md",
      "notes/ra.mct.md",
      "notes/ra.measure.md",
      "notes/ra.metric.md",
      "notes/ra.outer.md",
      "notes/ra.rn.md",
      "notes/ra.signed.md",
      "notes/ra.sobolev.md",
      "notes/ra.uniform.md",
      "notes/sl.cantor.md",
      "notes/sl.cardinals.md",
      "notes/sl.ch.md",
      "notes/sl.choice.md",
      "notes/sl.compactness.md",
      "notes/sl.completeness.md",
      "notes/sl.computability.md",
      "notes/sl.forcing.md",
      "notes/sl.halting.md",
      "notes/sl.incompleteness-one.md",
      "notes/sl.incompleteness-two.md",
      "notes/sl.lowenheim-skolem.md",
      "notes/sl.ordinals.md",
      "notes/sl.semantics.md",
      "notes/sl.sets.md",
      "notes/sl.soundness.md",
      "notes/sl.syntax.md",
      "notes/sl.transfinite.md",
      "notes/sl.types.md",
      "notes/sl.zf.md",
      "notes/tp.cohomology.md",
      "notes/tp.compact.md",
      "notes/tp.connected.md",
      "notes/tp.coverings.md",
      "notes/tp.cw.md",
      "notes/tp.exact.md",
      "notes/tp.excision.md",
      "notes/tp.fundamental.md",
      "notes/tp.homology.md",
      "notes/tp.homotopy.md",
      "notes/tp.manifolds.md",
      "notes/tp.mayer-vietoris.md",
      "notes/tp.metric.md",
      "notes/tp.metrization.md",
      "notes/tp.poincare.md",
      "notes/tp.separation.md",
      "notes/tp.spaces.md",
      "notes/tp.subspace.md",
      "notes/tp.tychonoff.md",
      "notes/tp.van-kampen.md"
    ]
  }
}
