{
  "format": "graph-studio-workspace",
  "version": 1,
  "name": "Factorio production",
  "graphs": [
    "science-1-per-second.json",
    "rocket-1-per-second.json"
  ],
  "defaultGraph": "science-1-per-second.json",
  "metadata": {
    "version": "2.0.65",
    "quantityBasis": "Per-second target-driven material balances",
    "sciencePackCount": 12,
    "assets": [
      "README.md"
    ]
  }
}
