{
  "format": "graph-studio-workspace",
  "version": 1,
  "name": "Spatial Atlas",
  "graphs": [
    "all-sky.json",
    "world-cities.json",
    "beijing-metro.json",
    "shanghai-metro.json"
  ],
  "defaultGraph": "all-sky.json",
  "metadata": {
    "assets": [
      "README.md",
      "SOURCES.md",
      "CELESTIAL-LICENSE.txt"
    ]
  }
}
