{
  "format": "graph-studio-workspace",
  "version": 1,
  "name": "Mathematics",
  "graphs": [
    "mathematics.json",
    "algebra.json",
    "analysis.json",
    "discrete-mathematics.json",
    "geometry.json",
    "mathematical-logic-and-foundations.json",
    "number-theory.json",
    "probability-theory.json",
    "topology.json"
  ],
  "defaultGraph": "mathematics.json",
  "metadata": {
    "source": "math/content/math.json",
    "concepts": 112,
    "assets": [
      "notes/Abelian_Variety.md",
      "notes/Affine_Space.md",
      "notes/Algebra_Structure.md",
      "notes/Automorphic_Form.md",
      "notes/Banach_Space.md",
      "notes/Bessel_Function.md",
      "notes/Binary_Tree.md",
      "notes/Bipartite_Graph.md",
      "notes/Boolean_Algebra.md",
      "notes/Branching_Process.md",
      "notes/Brownian_Motion.md",
      "notes/Chain_Complex.md",
      "notes/Complete_Graph.md",
      "notes/Complex_Field.md",
      "notes/Cone.md",
      "notes/Convex_Set.md",
      "notes/Cubic_Function.md",
      "notes/Differential_Manifold.md",
      "notes/Diffusion_Process.md",
      "notes/Dirac_Delta_Function.md",
      "notes/Directed_Acyclic_Graph.md",
      "notes/Dirichlet_Character.md",
      "notes/Dirichlet_Series.md",
      "notes/Elliptic_Curve.md",
      "notes/Elliptic_Integral.md",
      "notes/Euclidean_Space.md",
      "notes/Exponential_Function.md",
      "notes/Fiber_Bundle.md",
      "notes/Field.md",
      "notes/Filtered_Probability_Space.md",
      "notes/Fourth_Order_Function.md",
      "notes/Fractal.md",
      "notes/Function.md",
      "notes/Galois_Representation.md",
      "notes/Gamma_Function.md",
      "notes/Gaussian_Process.md",
      "notes/Global_Field.md",
      "notes/Graph.md",
      "notes/Group.md",
      "notes/Hausdorff_Space.md",
      "notes/Hilbert_Space.md",
      "notes/Holomorphic_Function.md",
      "notes/Hypergeometric_Function.md",
      "notes/Inner_Product_Space.md",
      "notes/Integer_Ring.md",
      "notes/Knot.md",
      "notes/L_Function.md",
      "notes/Lattice.md",
      "notes/Levy_Process.md",
      "notes/Lie_Algebra.md",
      "notes/Lie_Group.md",
      "notes/Linear_Function.md",
      "notes/Linear_Space.md",
      "notes/Linear_Transformation.md",
      "notes/Local_Field.md",
      "notes/Logic.md",
      "notes/Manifold.md",
      "notes/Markov_Chain.md",
      "notes/Markov_Process.md",
      "notes/Martingale.md",
      "notes/Measurable_Space.md",
      "notes/Measure_Space.md",
      "notes/Metric_Space.md",
      "notes/Mobius_Function.md",
      "notes/Modular_Curve.md",
      "notes/Modular_Form.md",
      "notes/Module.md",
      "notes/Natural_Number.md",
      "notes/Normed_Linear_Space.md",
      "notes/Number_Field.md",
      "notes/Ordered_Set.md",
      "notes/Point_Process.md",
      "notes/Poisson_Point_Process.md",
      "notes/Poisson_Process.md",
      "notes/Polyhedron.md",
      "notes/Polynomial_Function.md",
      "notes/Prime.md",
      "notes/Probability_Distribution.md",
      "notes/Probability_Space.md",
      "notes/Projective_Space.md",
      "notes/Quadratic_Function.md",
      "notes/Quaternion_Ring.md",
      "notes/Radon_Transform.md",
      "notes/Random_Element.md",
      "notes/Random_Field.md",
      "notes/Random_Variable.md",
      "notes/Random_Walk.md",
      "notes/Rational_Number_Field.md",
      "notes/Real_Field.md",
      "notes/Relation.md",
      "notes/Riemann_Zeta_Function.md",
      "notes/Riemannian_Manifold.md",
      "notes/Ring.md",
      "notes/Scheme.md",
      "notes/Semimartingale.md",
      "notes/Sequence.md",
      "notes/Set.md",
      "notes/Sheaf.md",
      "notes/Simplex.md",
      "notes/Spherical_Harmonics.md",
      "notes/Stationary_Process.md",
      "notes/Stochastic_Process.md",
      "notes/Stopping_Time.md",
      "notes/Symplectic_Manifold.md",
      "notes/Tensor.md",
      "notes/Topological_Space.md",
      "notes/Tree.md",
      "notes/Vector_Bundle.md",
      "notes/p_Adic_Number.md",
      "notes/Real_Valued_Function.md",
      "notes/Real_Valued_Sequence.md",
      "notes/Complex_Valued_Function.md",
      "README.md"
    ]
  }
}
