{
  "format": "graph-studio-workspace",
  "version": 1,
  "name": "中国历史",
  "graphs": [
    "china-history.json"
  ],
  "defaultGraph": "china-history.json",
  "metadata": {
    "language": "zh-CN",
    "nodeCount": 1273,
    "edgeCount": 2322,
    "themeCount": 6,
    "polityCount": 109,
    "assets": [
      "README.md",
      "SOURCES.md",
      "notes/conflict.md",
      "notes/diplomacy.md",
      "notes/early-catalog.md",
      "notes/early-china.md",
      "notes/economy.md",
      "notes/han-three-catalog.md",
      "notes/han-three-sources.md",
      "notes/han-three.md",
      "notes/ideas.md",
      "notes/jin-sui-catalog.md",
      "notes/jin-sui-sources.md",
      "notes/jin-sui.md",
      "notes/polity.md",
      "notes/pre-zhou-catalog.md",
      "notes/pre-zhou-sources.md",
      "notes/pre-zhou.md",
      "notes/tang-song-catalog.md",
      "notes/tang-song-sources.md",
      "notes/tang-song.md",
      "notes/technology.md",
      "notes/yuan-qing-catalog.md",
      "notes/yuan-qing-sources.md",
      "notes/yuan-qing.md"
    ]
  }
}
